{
  "schemaVersion": 1,
  "status": "scored",
  "condition": "full",
  "cognition": "heuristic",
  "configPath": "examples/minimal.yaml",
  "worldSeeds": [3201, 3202, 3203],
  "trialsPerSeed": 2,
  "aggregates": {
    "discoveryFrontierAuc": {
      "mean": 0.03651240609659548,
      "std": 0.006123467294277672
    },
    "bestArtifactPerformance": {
      "mean": 0.0584609887163689,
      "std": 0.006912875084908737
    },
    "evaluations": {
      "80": [
        {
          "seed": 9201,
          "resilienceAuc": {
            "mean": 0,
            "std": 0
          },
          "serviceAuc": {
            "water": {
              "mean": 0,
              "std": 0
            },
            "remediation": {
              "mean": 0,
              "std": 0
            },
            "stability": {
              "mean": 0,
              "std": 0
            },
            "healing": {
              "mean": 0,
              "std": 0
            },
            "nutrient": {
              "mean": 0,
              "std": 0
            }
          },
          "finalCoverage": {
            "water": {
              "mean": 0,
              "std": 0
            },
            "remediation": {
              "mean": 0,
              "std": 0
            },
            "stability": {
              "mean": 0,
              "std": 0
            },
            "healing": {
              "mean": 0,
              "std": 0
            },
            "nutrient": {
              "mean": 0,
              "std": 0
            }
          }
        },
        {
          "seed": 9202,
          "resilienceAuc": {
            "mean": 0,
            "std": 0
          },
          "serviceAuc": {
            "water": {
              "mean": 0,
              "std": 0
            },
            "remediation": {
              "mean": 0,
              "std": 0
            },
            "stability": {
              "mean": 0,
              "std": 0
            },
            "healing": {
              "mean": 0,
              "std": 0
            },
            "nutrient": {
              "mean": 0,
              "std": 0
            }
          },
          "finalCoverage": {
            "water": {
              "mean": 0,
              "std": 0
            },
            "remediation": {
              "mean": 0,
              "std": 0
            },
            "stability": {
              "mean": 0,
              "std": 0
            },
            "healing": {
              "mean": 0,
              "std": 0
            },
            "nutrient": {
              "mean": 0,
              "std": 0
            }
          }
        }
      ],
      "160": [
        {
          "seed": 9201,
          "resilienceAuc": {
            "mean": 0.03958010182947084,
            "std": 0.015144568460768325
          },
          "serviceAuc": {
            "water": {
              "mean": 0.15500159978106867,
              "std": 0.14839363838854816
            },
            "remediation": {
              "mean": 0.001390665068882877,
              "std": 0.0002651711895439597
            },
            "stability": {
              "mean": 0.23940875344475687,
              "std": 0.009889952234359073
            },
            "healing": {
              "mean": 0,
              "std": 0
            },
            "nutrient": {
              "mean": 0,
              "std": 0
            }
          },
          "finalCoverage": {
            "water": {
              "mean": 0.171,
              "std": 0.1713312580937874
            },
            "remediation": {
              "mean": 0.0010710687908590955,
              "std": 0.00020771192150023857
            },
            "stability": {
              "mean": 0.20983870232698645,
              "std": 0.015415612263165663
            },
            "healing": {
              "mean": 0,
              "std": 0
            },
            "nutrient": {
              "mean": 0,
              "std": 0
            }
          }
        },
        {
          "seed": 9202,
          "resilienceAuc": {
            "mean": 0.03958010182947084,
            "std": 0.015144568460768325
          },
          "serviceAuc": {
            "water": {
              "mean": 0.15500159978106867,
              "std": 0.14839363838854816
            },
            "remediation": {
              "mean": 0.001390665068882877,
              "std": 0.0002651711895439597
            },
            "stability": {
              "mean": 0.23940875344475687,
              "std": 0.009889952234359073
            },
            "healing": {
              "mean": 0,
              "std": 0
            },
            "nutrient": {
              "mean": 0,
              "std": 0
            }
          },
          "finalCoverage": {
            "water": {
              "mean": 0.171,
              "std": 0.1713312580937874
            },
            "remediation": {
              "mean": 0.0010710687908590955,
              "std": 0.00020771192150023857
            },
            "stability": {
              "mean": 0.20983870232698645,
              "std": 0.015415612263165663
            },
            "healing": {
              "mean": 0,
              "std": 0
            },
            "nutrient": {
              "mean": 0,
              "std": 0
            }
          }
        }
      ]
    }
  },
  "trials": [
    {
      "worldSeed": 3201,
      "trial": 0,
      "runId": "full-n8-s3201-26e5220e",
      "configHash": "26e5220e077b583636351d7516054347fd32015bf0b512c54d81b93165cdf3e0",
      "traceHash": "88b816fcaf11e74262ced019d7fde59fef98a09ac760ce975dbf277e453c3332",
      "events": 1524,
      "artifacts": 6,
      "programs": 1,
      "discoveryFrontierAuc": 0.03698237105773533,
      "bestArtifactPerformance": 0.05529154717018736,
      "evaluations": {
        "80": [
          {
            "seed": 9201,
            "resilienceAuc": 0,
            "serviceAuc": {
              "water": 0,
              "remediation": 0,
              "stability": 0,
              "healing": 0,
              "nutrient": 0
            },
            "finalCoverage": {
              "water": 0,
              "remediation": 0,
              "stability": 0,
              "healing": 0,
              "nutrient": 0
            }
          },
          {
            "seed": 9202,
            "resilienceAuc": 0,
            "serviceAuc": {
              "water": 0,
              "remediation": 0,
              "stability": 0,
              "healing": 0,
              "nutrient": 0
            },
            "finalCoverage": {
              "water": 0,
              "remediation": 0,
              "stability": 0,
              "healing": 0,
              "nutrient": 0
            }
          }
        ],
        "160": [
          {
            "seed": 9201,
            "resilienceAuc": 0.056922650027800274,
            "serviceAuc": {
              "water": 0.3300047993432062,
              "remediation": 0.0015138351074791539,
              "stability": 0.2377078658273176,
              "healing": 0,
              "nutrient": 0
            },
            "finalCoverage": {
              "water": 0.378,
              "remediation": 0.0010736197766912188,
              "stability": 0.20273538936434038,
              "healing": 0,
              "nutrient": 0
            }
          },
          {
            "seed": 9202,
            "resilienceAuc": 0.056922650027800274,
            "serviceAuc": {
              "water": 0.3300047993432062,
              "remediation": 0.0015138351074791539,
              "stability": 0.2377078658273176,
              "healing": 0,
              "nutrient": 0
            },
            "finalCoverage": {
              "water": 0.378,
              "remediation": 0.0010736197766912188,
              "stability": 0.20273538936434038,
              "healing": 0,
              "nutrient": 0
            }
          }
        ]
      },
      "validatedInventions": 0
    },
    {
      "worldSeed": 3201,
      "trial": 1,
      "runId": "full-n8-s3201-26e5220e",
      "configHash": "26e5220e077b583636351d7516054347fd32015bf0b512c54d81b93165cdf3e0",
      "traceHash": "88b816fcaf11e74262ced019d7fde59fef98a09ac760ce975dbf277e453c3332",
      "events": 1524,
      "artifacts": 6,
      "programs": 1,
      "discoveryFrontierAuc": 0.03698237105773533,
      "bestArtifactPerformance": 0.05529154717018736,
      "evaluations": {
        "80": [
          {
            "seed": 9201,
            "resilienceAuc": 0,
            "serviceAuc": {
              "water": 0,
              "remediation": 0,
              "stability": 0,
              "healing": 0,
              "nutrient": 0
            },
            "finalCoverage": {
              "water": 0,
              "remediation": 0,
              "stability": 0,
              "healing": 0,
              "nutrient": 0
            }
          },
          {
            "seed": 9202,
            "resilienceAuc": 0,
            "serviceAuc": {
              "water": 0,
              "remediation": 0,
              "stability": 0,
              "healing": 0,
              "nutrient": 0
            },
            "finalCoverage": {
              "water": 0,
              "remediation": 0,
              "stability": 0,
              "healing": 0,
              "nutrient": 0
            }
          }
        ],
        "160": [
          {
            "seed": 9201,
            "resilienceAuc": 0.056922650027800274,
            "serviceAuc": {
              "water": 0.3300047993432062,
              "remediation": 0.0015138351074791539,
              "stability": 0.2377078658273176,
              "healing": 0,
              "nutrient": 0
            },
            "finalCoverage": {
              "water": 0.378,
              "remediation": 0.0010736197766912188,
              "stability": 0.20273538936434038,
              "healing": 0,
              "nutrient": 0